Sheet: FCBLandedCostReportResults
A1: Good Receipt Report number | B1: Inbound Shipment No | C1: Date | D1: Creditor Name | E1: Item | F1: Display Name | G1: Item Type | H1: PO No. | I1: Project | J1: Quantity | K1: UOM | L1: Currency | M1: Exchange Rate | N1: Unit Price | O1: Subtotal | P1: Total (MYR) | Q1: Total cost per shipnment | R1: Custom Duties | S1: Freight Charges | T1: Marine Insurance | U1: Handling Charges | V1: Forwarding Charges | W1: Total(Landed cost) | X1: Total Landed cost per shipment | Y1: Total (MYR) | Z1: Grand Total (Cost + Landed cost ) | AA1: Cost Per unit
A2: <a href="https://6865308.app.netsuite.com/app/accounting/transactions/itemrcpt.nl?id=34557">ITEMRCPT272</a> | B2: - None - | C2: 2023-01-17T00:00:00.000 | D2: ANQING YIPAK PACKAGING MATERIAL CO., LTD | E2: zA72-YST-1950 | F2: Steam Sterilization Indicator Tapes, 19mmx50m/roll (48rolls/case) | G2: MICROBIOLOGY | H2: <a href="https://6865308.app.netsuite.com/app/accounting/transactions/purchord.nl?id=34555">Purchase Order #PO-000151</a> | I2: - None - | J2: 6 | K2: CASE/48 | L2: USD | M2: 4.3159999999999998 | N2: 64.8 | O2: 388.8 | R2: 0 | S2: 0 | T2: 0 | U2: 0 | V2: 0 | Y2: 1678.0609999999999
A3: <a href="https://6865308.app.netsuite.com/app/accounting/transactions/itemrcpt.nl?id=35586">ITEMRCPT273</a> | B3: - None - | C3: 2023-01-19T00:00:00.000 | D3: LP ITALIANA SPA | E3: zL03-111547 | F3: 17x120mm, 15mL PP Tube w/Screw Cap | G3: PLASTIC LABWARES | H3: <a href="https://6865308.app.netsuite.com/app/accounting/transactions/purchord.nl?id=35485">Purchase Order #155</a> | I3: - None - | J3: 12 | K3: CASE/1000 | L3: EUR | M3: 4.6539215 | N3: 83 | O3: 996 | R3: 0 | S3: 0 | T3: 0 | U3: 0 | V3: 0 | Y3: 4635.3059999999996
A4: <a href="https://6865308.app.netsuite.com/app/accounting/transactions/itemrcpt.nl?id=35586">ITEMRCPT273</a> | B4: - None - | C4: 2023-01-19T00:00:00.000 | D4: LP ITALIANA SPA | E4: zL03-206148 | F4: 60mL, Sterile Clear PP SCR/Cap Container with Label, 40x60mm Height | G4: PLASTIC LABWARES | H4: <a href="https://6865308.app.netsuite.com/app/accounting/transactions/purchord.nl?id=35485">Purchase Order #155</a> | I4: - None - | J4: 3 | K4: CASE/600 | L4: EUR | M4: 4.6539215 | N4: 45 | O4: 135 | R4: 0 | S4: 0 | T4: 0 | U4: 0 | V4: 0 | Y4: 628.279
A5: Sub Total | R5: 0 | S5: 0 | T5: 0 | U5: 0 | V5: 0 | X5: =SUM(RC[-6]:RC[-2]) -> 0
A6: <a href="https://6865308.app.netsuite.com/app/accounting/transactions/itemrcpt.nl?id=35588">ITEMRCPT274</a> | B6: INBSHIP52 | C6: 2023-01-19T00:00:00.000 | D6: CORNING GOSSELIN SAS | E6: zG22-OS10-02 | F6: 10uL + Needle Tip Inoculating Loops, Sterile, Calibrated, Wrapped per 20 irradiated in 1 zip bag | G6: PLASTIC LABWARES | H6: <a href="https://6865308.app.netsuite.com/app/accounting/transactions/purchord.nl?id=34511">Purchase Order #PO-000144</a> | I6: - None - | J6: 12 | K6: CASE/9000 | L6: EUR | M6: 4.6825000000000001 | N6: 182.43 | O6: 2189.16 | P6: =RC[-1]*RC[-3] -> 10250.741699999999 | R6: 0 | S6: 817.64 | T6: 60.98 | U6: 1802.941 | V6: 0 | W6: =SUM(RC[-5]:RC[-1]) -> 2681.5610000000001 | Y6: =RC[-9]+RC[-2] -> 12932.302699999998 | AA6: =RC[-2]/RC[-17] -> 1077.6918916666666
A7: <a href="https://6865308.app.netsuite.com/app/accounting/transactions/itemrcpt.nl?id=35588">ITEMRCPT274</a> | B7: INBSHIP52 | C7: 2023-01-19T00:00:00.000 | D7: CORNING GOSSELIN SAS | E7: zG22-SB93-101 | F7: Disposable Petri Dishes, 3 vents, Dia 90x14.2mm (33pcs/slv, 25slv/cs) | G7: PLASTIC LABWARES | H7: <a href="https://6865308.app.netsuite.com/app/accounting/transactions/purchord.nl?id=34511">Purchase Order #PO-000144</a> | I7: - None - | J7: 200 | K7: CASE/825 | L7: EUR | M7: 4.6825000000000001 | N7: 44.48 | O7: 8896 | P7: =RC[-1]*RC[-3] -> 41655.520000000004 | R7: 0 | S7: 1278.3599999999999 | T7: 95.34 | U7: 2818.8510000000001 | V7: 0 | W7: =SUM(RC[-5]:RC[-1]) -> 4192.5509999999995 | Y7: =RC[-9]+RC[-2] -> 45848.071000000004 | AA7: =RC[-2]/RC[-17] -> 229.24035500000002
A8: <a href="https://6865308.app.netsuite.com/app/accounting/transactions/itemrcpt.nl?id=35588">ITEMRCPT274</a> | B8: INBSHIP52 | C8: 2023-01-19T00:00:00.000 | D8: CORNING GOSSELIN SAS | E8: zG22-SM2-01 | F8: Stomacher bags 180x300mm, 400mL, Sterile, 5x(10x50)/case | G8: PLASTIC LABWARES | H8: <a href="https://6865308.app.netsuite.com/app/accounting/transactions/purchord.nl?id=34511">Purchase Order #PO-000144</a> | I8: - None - | J8: 28 | K8: CASE/2500 | L8: EUR | M8: 4.6825000000000001 | N8: 111.4 | O8: 3119.2 | P8: =RC[-1]*RC[-3] -> 14605.653999999999 | R8: 0 | S8: 178.971 | T8: 13.35 | U8: 394.64 | V8: 0 | W8: =SUM(RC[-5]:RC[-1]) -> 586.96100000000001 | Y8: =RC[-9]+RC[-2] -> 15192.614999999998 | AA8: =RC[-2]/RC[-17] -> 542.59339285714282
A9: <a href="https://6865308.app.netsuite.com/app/accounting/transactions/itemrcpt.nl?id=35589">ITEMRCPT275</a> | B9: INBSHIP52 | C9: 2023-01-19T00:00:00.000 | D9: CORNING GOSSELIN SAS | E9: zG22-SB93-101 | F9: Disposable Petri Dishes, 3 vents, Dia 90x14.2mm (33pcs/slv, 25slv/cs) | G9: PLASTIC LABWARES | H9: <a href="https://6865308.app.netsuite.com/app/accounting/transactions/purchord.nl?id=34512">Purchase Order #PO-000145</a> | I9: - None - | J9: 100 | K9: CASE/825 | L9: EUR | M9: 4.6825000000000001 | N9: 44.48 | O9: 4448 | P9: =RC[-1]*RC[-3] -> 20827.760000000002 | R9: 0 | S9: 639.17999999999995 | T9: 47.668999999999997 | U9: 1409.42 | V9: 0 | W9: =SUM(RC[-5]:RC[-1]) -> 2096.2690000000002 | Y9: =RC[-9]+RC[-2] -> 22924.029000000002 | AA9: =RC[-2]/RC[-17] -> 229.24029000000002
A10: Sub Total per Shipment* | O10: =SUM(R[-5]C:R[-1]C) -> 18652.36 | P10: =SUM(R[-4]C:R[-1]C) -> 87339.675699999993 | Q10: =RC[-1] -> 87339.675699999993 | R10: =SUM(R[-4]C:R[-1]C) -> 0 | S10: =SUM(R[-4]C:R[-1]C) -> 2914.1509999999998 | T10: =SUM(R[-4]C:R[-1]C) -> 217.339 | U10: =SUM(R[-4]C:R[-1]C) -> 6425.8520000000008 | V10: =SUM(R[-4]C:R[-1]C) -> 0 | W10: =SUM(RC[-5]:RC[-1]) -> 9557.3420000000006 | X10: =RC[-1] -> 9557.3420000000006 | Y10: =SUM(R[-4]C:R[-1]C) -> 96897.017699999997 | Z10: =RC[-9]+RC[-2] -> 96897.017699999997
A11: <a href="https://6865308.app.netsuite.com/app/accounting/transactions/itemrcpt.nl?id=36305">ITEMRCPT278</a> | B11: INBSHIP56 | C11: 2023-01-31T00:00:00.000 | D11: ANQING YIPAK PACKAGING MATERIAL CO., LTD | E11: zA72-YST-1950 | F11: Steam Sterilization Indicator Tapes, 19mmx50m/roll (48rolls/case) | G11: MICROBIOLOGY | H11: <a href="https://6865308.app.netsuite.com/app/accounting/transactions/purchord.nl?id=36304">Purchase Order #PO-000156</a> | I11: - None - | J11: 6 | K11: CASE/48 | L11: USD | M11: 4.2439999999999998 | N11: 64.8 | O11: 388.8 | P11: =+RC[-3]*RC[-1] -> 1650.0672 | R11: 417.34899999999999 | S11: 1249.981 | T11: 3.6709999999999998 | U11: 0 | V11: 0 | X11: =SUM(RC[-6]:RC[-2]) -> 1671.001 | Y11: =SUM(RC[-9]+RC[-1]) -> 3321.0681999999997 | AA11: =RC[-2]/RC[-17] -> 553.51136666666662
A12: Sub Total | N12: 0 | O12: 0 | R12: 417.35 | S12: 4164.13 | T12: 221.01 | U12: 6425.85 | V12: 0 | Y12: 147775.37
A17: * Amendments need to be made in the FCB Landed cost Reports.